{
  "$schema": "https://crossforge.dev/schemas/gcc-testsuite-plan.schema.json",
  "schema_version": 1,
  "kind": "gcc-testsuite-plan",
  "profile": "smoke",
  "gcc_version": "15.2.1",
  "unexpected_statuses": [
    "ERROR",
    "FAIL",
    "KFAIL",
    "KPASS",
    "UNRESOLVED",
    "WARNING",
    "XPASS"
  ],
  "site": {
    "file": "tests/gcc/site.exp",
    "sha256": "36999b634467c638dee5782149e3692fc3c00b472036ea0228600a7bbc0768f2"
  },
  "suites": [
    {
      "id": "gcc.execute",
      "make_target": "check-gcc",
      "sum_file": "gcc/testsuite/gcc/gcc.sum",
      "runtestflags": [
        "execute.exp=20000112-1.c"
      ]
    }
  ],
  "targets": [
    {
      "arch": "x86_64",
      "triple": "x86_64-unknown-linux-gnu",
      "runtime_tiers": [
        {
          "name": "host-direct",
          "board": {
            "name": "crossforge-x86_64",
            "file": "tests/gcc/boards/crossforge-x86_64.exp",
            "sha256": "e58d22f29110d15e91d89443ee16bde73d871543d3c5e294a2d6126f584e5c05"
          }
        }
      ]
    },
    {
      "arch": "aarch64",
      "triple": "aarch64-unknown-linux-gnu",
      "runtime_tiers": [
        {
          "name": "locked-sysroot",
          "board": {
            "name": "crossforge-aarch64-locked",
            "file": "tests/gcc/boards/crossforge-aarch64-locked.exp",
            "sha256": "df04f7723a6967ed32219986314f32b7ddd886772ce810f0b3e1d5191bf8ef16"
          }
        },
        {
          "name": "clean-rocky",
          "board": {
            "name": "crossforge-aarch64-clean",
            "file": "tests/gcc/boards/crossforge-aarch64-clean.exp",
            "sha256": "b2fe504bc715f74e8490deb7f9078bece0b38162cb099360c1105ddb9fcb218b"
          }
        }
      ]
    }
  ]
}
