{
  "$schema": "https://crossforge.dev/schemas/gcc-testsuite-plan.schema.json",
  "schema_version": 1,
  "kind": "gcc-testsuite-plan",
  "profile": "full",
  "gcc_version": "15.2.1",
  "host_gcc_major": "8",
  "jobs": 4,
  "unexpected_statuses": [
    "ERROR",
    "FAIL",
    "KFAIL",
    "KPASS",
    "UNRESOLVED",
    "WARNING",
    "XPASS"
  ],
  "site": {
    "file": "tests/gcc/full-site.exp",
    "sha256": "32cf16b5648aae8c6a6200e1985ac653edc0cebd37b873f12b30a024a2deaf96"
  },
  "source_patches": [
    {
      "id": "libstdcxx-dumpfullversion",
      "suite": "libstdc++.full",
      "file": "patches/gcc/0001-libstdcxx-use-dumpfullversion.patch",
      "sha256": "2b4494622a40ccbe7ae450bab6993482677bde81cccb3ad4ef940060372dbf1d",
      "strip": 1,
      "targets": [
        {
          "file": "libstdc++-v3/testsuite/lib/dts.exp",
          "before_sha256": "882fda388274fe4576d0fd7438e05cf0d9a58521fde0f362391b48a8a36aa8b9",
          "after_sha256": "3862b02f6b329f6be7fe31cef254c7680c60e3b72c52faacd9b0eae483a3b593"
        }
      ]
    },
    {
      "id": "libstdcxx-el8-pr93672-hang",
      "suite": "libstdc++.full",
      "file": "patches/gcc/0004-libstdcxx-skip-el8-pr93672-hang.patch",
      "sha256": "55ebd4164f14710bd662305ed806499c620a73e065505aa091e5908eb8022625",
      "strip": 1,
      "targets": [
        {
          "file": "libstdc++-v3/testsuite/27_io/basic_istream/ignore/char/93672.cc",
          "before_sha256": "42570e6e201b64830d44e3c0c993408f6e9966b5091f1d3f00567bfa38e78020",
          "after_sha256": "6e2d606511f1c00eb69e00778275953ec7d82293c33a637a906006a1b7ea3ae6"
        }
      ]
    },
    {
      "id": "testsuite-gcov-under-test",
      "suite": "g++.full",
      "file": "patches/gcc/0002-testsuite-honor-gcov-under-test.patch",
      "sha256": "302280973e6e9c5b47219da36e1b90d2a06ba4a1b250313ab340799364dd335e",
      "strip": 1,
      "targets": [
        {
          "file": "gcc/testsuite/g++.dg/gcov/gcov.exp",
          "before_sha256": "f0656bfcddeae61ef20dd25aa599d2fa6fe284e058d9ed350b3803eb578db8b5",
          "after_sha256": "7b394237a6bee05dac22ed20325473c7d1f507bc4b453bb658660d2700a42d32"
        }
      ]
    },
    {
      "id": "gcc-testsuite-gcov-under-test",
      "suite": "gcc.full",
      "file": "patches/gcc/0005-gcc-testsuite-honor-gcov-under-test.patch",
      "sha256": "dadb6bcd96c250d1b7d381c05f4efec48fb60fe09db147a8cf0bcfff99f9bac6",
      "strip": 1,
      "targets": [
        {
          "file": "gcc/testsuite/gcc.misc-tests/gcov.exp",
          "before_sha256": "d66fad345baa8fb4134af67e9172c2562c2a73865af00ea458a0b57da2204200",
          "after_sha256": "b604c19b36e99601a7b16f9d99557d65ec48669f5968162b5befeadb18c7aca8"
        }
      ]
    },
    {
      "id": "testsuite-cross-gcc-ar",
      "suite": "gcc.full",
      "file": "patches/gcc/0003-testsuite-honor-cross-gcc-ar.patch",
      "sha256": "38a9f473bcb11ba773e7ba78f13ed5dd8332c50aa9533e47ad3b5fd4a27fdb46",
      "strip": 1,
      "targets": [
        {
          "file": "gcc/testsuite/lib/lto.exp",
          "before_sha256": "a8c523bad8d33994d41354d021b6bd248a2f785c217b9a5e01a05203cb3b9a03",
          "after_sha256": "e95feeaf2771859c3f5bb1cea791b2337b0845e48ec1ad453f6d8da68d8234ef"
        }
      ]
    },
    {
      "id": "gxx-native-avx10-alias",
      "suite": "g++.full",
      "file": "patches/gcc/0006-gxx-expect-native-avx10-alias.patch",
      "sha256": "77ef391d5c06f7862d81d82177131d3632150ef09ee66b24cd4aa92a2137e7e7",
      "strip": 1,
      "targets": [
        {
          "file": "gcc/testsuite/g++.dg/pr90773-1d.C",
          "before_sha256": "0ea7fa2f6428cf6cce3e4c0ef971c32ee346e673f75e01084c6950faf71115e6",
          "after_sha256": "0b4807dcc307f9d4db7f1d4c1ae7dd56e277cfdea8a7df281abc9476accfef17"
        }
      ]
    },
    {
      "id": "gcc-native-avx10-alias",
      "suite": "gcc.full",
      "file": "patches/gcc/0007-gcc-expect-native-avx10-alias.patch",
      "sha256": "e24535b988304f04a0738f27607f5eab4486098bcdaf1fa9bac51657365e65df",
      "strip": 1,
      "targets": [
        {
          "file": "gcc/testsuite/gcc.target/i386/pr101395-2.c",
          "before_sha256": "487a8417b74e8acba5d75f670ebd376ee6ceb6c2d9d33f590f3b189fd3e23e6d",
          "after_sha256": "103fb18ef3ddd887903dbeb04f573f2539a5c01f9bd192ed69db34d2abc23b73"
        },
        {
          "file": "gcc/testsuite/gcc.target/i386/pr101395-3.c",
          "before_sha256": "f6e0e1d7053f39690668c438e95deee058541c2dd929421b7fb3012d6a5be392",
          "after_sha256": "2a83fb4ee1cd084efcfdf8c59ca8116e6a5f0e305d43d0712636b06979f0ec90"
        },
        {
          "file": "gcc/testsuite/gcc.target/i386/pr115978-1.c",
          "before_sha256": "6acb318297466bb32fcb4576ddf218074f58ed6404c90ea6d8f5ccf95db2a4bd",
          "after_sha256": "ebd218d98ce58989314303f0e59ba9c86f18082a3dedb30addfd22869ef8fbad"
        },
        {
          "file": "gcc/testsuite/gcc.target/i386/pr115978-2.c",
          "before_sha256": "006c5b0ed4574552272a0512d2cb5975e77ac976d7bda0b2779f4921a5805e3d",
          "after_sha256": "e7c6b59698ed6e7baaca3bcfabccc479360378bf000cb010ed77eb36793db59e"
        },
        {
          "file": "gcc/testsuite/gcc.target/i386/pr57275.c",
          "before_sha256": "8a08207008a685652f10111c2475b4f1eaba541b902a3ceb21e17203c1bfc798",
          "after_sha256": "89a183d50749b692aec8e2f5f1d7cda27d772062515689e3df50fd354ef597b5"
        }
      ]
    }
  ],
  "suites": [
    {
      "id": "g++.full",
      "make_target": "check-g++",
      "make_directory": "gcc",
      "sum_file": "gcc/testsuite/g++/g++.sum",
      "runtestflags": []
    },
    {
      "id": "gcc.full",
      "make_target": "check-gcc",
      "make_directory": "gcc",
      "sum_file": "gcc/testsuite/gcc/gcc.sum",
      "runtestflags": []
    },
    {
      "id": "libgomp.full",
      "make_target": "check-target-libgomp",
      "sum_file": "{target}/libgomp/testsuite/libgomp.sum",
      "runtestflags": []
    },
    {
      "id": "libstdc++.full",
      "driver": "runtest-installed",
      "tool": "libstdc++",
      "timeout_seconds": 7200,
      "sum_file": "libstdc++.sum",
      "runtestflags": []
    }
  ],
  "targets": [
    {
      "arch": "x86_64",
      "triple": "x86_64-unknown-linux-gnu",
      "runtime_tiers": [
        {
          "name": "host-direct",
          "board": {
            "name": "crossforge-x86_64",
            "file": "tests/gcc/boards/crossforge-x86_64.exp",
            "sha256": "e58d22f29110d15e91d89443ee16bde73d871543d3c5e294a2d6126f584e5c05"
          }
        }
      ]
    }
  ]
}
